{
  "contract": "aiverse-capability-provider-v1",
  "provider_id": "aiverse-skills",
  "generation_id": "example-generation-1",
  "manifest_sha256": "0000000000000000000000000000000000000000000000000000000000000000",
  "capabilities": [
    {
      "id": "aiverse-skills:copywriting",
      "name": "Copywriting",
      "description": "Write product copy using the supplied context.",
      "visibility": "shared",
      "version": "example-version",
      "path": "imported/corey-haines/copywriting",
      "package_state": "valid",
      "digest": {
        "algorithm": "aiverse-package-sha256-v1",
        "value": "0000000000000000000000000000000000000000000000000000000000000000"
      },
      "operators": [],
      "dependencies": []
    }
  ]
}
